{
  "schema_version": "icwm.g0c.request-vector-corpus.v2",
  "corpus_id": "338c873c569faa4816785a223a6c12d4f89c1c080bf4cc83cc89dc0fa1452ad8",
  "identity_algorithm": "Each vector is sha256 of canonical JSON for schema_version, operation, purpose, request, response_cases, responses, and oracle_comparison. The corpus is sha256 of canonical JSON for schema_version, oracle, limits, duplicate_query_key_policy, response_grammar, required_operations, required_purposes, full vectors, and capability_expectations.",
  "candidate_contract": "same_corpus_for_every_candidate",
  "candidate_contract_note": "Every candidate must consume these exact request and response cases without candidate-specific omissions or rewrites.",
  "known_coverage_gaps": [
    "No candidate adapter has executed this v2 corpus yet.",
    "Effect and failpoint coverage remains unexecuted for these request operations.",
    "This publication does not claim Wave 2 or Gate 0 acceptance.",
    "HTTP-date Retry-After parsing and precedence is not executed; v2 tests only delta-seconds=120 over legacy retry_after_ms=5000."
  ],
  "oracle": {
    "role": "test-only credential-free request-shape oracle; not a production dependency",
    "repository": "https://github.com/ruma/ruma",
    "commit": "ea3455221fd99985256b196866abb85e22ff4bdd",
    "packages": [
      {
        "name": "ruma-client-api",
        "version": "0.24.0",
        "features": [
          "client"
        ]
      },
      {
        "name": "ruma-common",
        "version": "0.19.0",
        "features": [
          "api",
          "client"
        ]
      }
    ],
    "features": [
      "ruma-client-api/client",
      "ruma-common/api",
      "ruma-common/client"
    ],
    "default_features": false,
    "rustc": "1.96.0 (ac68faa20 2026-05-25)",
    "cargo": "1.96.0 (30a34c682 2026-05-25)",
    "lockfile": "oracles/ruma-request-v2/Cargo.lock",
    "lockfile_sha256": "88a49a5a3db983232d59c68ecfedaa74dd57a6f171f24bf306efbc8f816cc1e5"
  },
  "limits": {
    "max_headers": 32,
    "max_query_pairs": 32,
    "max_name_bytes": 128,
    "max_value_bytes": 8192,
    "max_path_bytes": 8192,
    "max_body_bytes": 1048576,
    "max_retry_after_seconds": 86400,
    "max_retry_after_ms": 86400000
  },
  "duplicate_query_key_policy": "reject",
  "response_grammar": {
    "success": {
      "status_range": [
        200,
        299
      ],
      "headers": "ordered_name_value_pairs",
      "body": "bounded_json_or_empty"
    },
    "error": {
      "status_range": [
        400,
        599
      ],
      "headers": "ordered_name_value_pairs",
      "body": {
        "required": [
          "errcode",
          "error"
        ]
      }
    },
    "rate_limited": {
      "status": 429,
      "headers": {
        "Retry-After": "delta-seconds only in v2; HTTP-date unexecuted"
      },
      "body": {
        "errcode": "M_LIMIT_EXCEEDED",
        "legacy_optional": "retry_after_ms"
      }
    }
  },
  "required_operations": [
    "sync",
    "keys_query",
    "keys_claim",
    "to_device",
    "room_send",
    "keys_upload",
    "device_list",
    "room_key_backup_version_create",
    "room_key_backup_version_get_current",
    "room_key_backup_version_get",
    "room_key_backup_version_update",
    "room_key_backup_version_delete",
    "room_keys_get_all",
    "room_keys_put_all",
    "room_keys_get_room",
    "room_keys_put_room",
    "room_keys_get_session",
    "room_keys_put_session",
    "cross_signing",
    "signatures_upload",
    "verification",
    "keys_changes"
  ],
  "required_purposes": [
    "sync",
    "keys_query",
    "keys_claim",
    "to_device",
    "room_send",
    "keys_upload",
    "device_list",
    "room_keys_backup",
    "cross_signing",
    "signatures_upload",
    "verification",
    "keys_changes"
  ],
  "vectors": [
    {
      "schema_version": "icwm.g0c.request-vector.v2",
      "vector_id": "09715ae1d08f9aeca3cb5161290885374eb87027f9bfd2fd9130b97568217f8f",
      "operation": "sync",
      "purpose": "sync",
      "request": {
        "method": "GET",
        "path": "/_matrix/client/v3/sync",
        "path_parameters": [],
        "query": [
          {
            "name": "since",
            "value": "s0"
          },
          {
            "name": "timeout",
            "value": "30000"
          }
        ],
        "headers": [],
        "body": null,
        "encoded_uri": "/_matrix/client/v3/sync?since=s0&timeout=30000"
      },
      "response_cases": [
        "success",
        "error",
        "rate_limited"
      ],
      "oracle_comparison": {
        "mode": "ruma_outgoing_request",
        "coverage": [
          "method",
          "encoded_uri",
          "body"
        ]
      },
      "responses": [
        {
          "kind": "success",
          "status": 200,
          "headers": [
            {
              "name": "Content-Type",
              "value": "application/json"
            }
          ],
          "body": {
            "next_batch": "s1",
            "rooms": {}
          },
          "parsing": {
            "expectation": "endpoint_success"
          }
        },
        {
          "kind": "error",
          "status": 403,
          "headers": [
            {
              "name": "Content-Type",
              "value": "application/json"
            }
          ],
          "body": {
            "errcode": "M_FORBIDDEN",
            "error": "request rejected"
          },
          "parsing": {
            "expectation": "matrix_error",
            "errcode": "M_FORBIDDEN"
          }
        },
        {
          "kind": "rate_limited",
          "status": 429,
          "headers": [
            {
              "name": "Retry-After",
              "value": "120"
            },
            {
              "name": "Content-Type",
              "value": "application/json"
            }
          ],
          "body": {
            "errcode": "M_LIMIT_EXCEEDED",
            "error": "rate limited",
            "retry_after_ms": 5000
          },
          "parsing": {
            "expectation": "retry_after",
            "retry_source": "retry_after_header_precedes_legacy_body",
            "retry_after_ms": 120000
          }
        }
      ]
    },
    {
      "schema_version": "icwm.g0c.request-vector.v2",
      "vector_id": "a9063093665459d831f904202d6ab4201e5e01fa54fc8a9af5a2a49214e20e9d",
      "operation": "keys_query",
      "purpose": "keys_query",
      "request": {
        "method": "POST",
        "path": "/_matrix/client/v3/keys/query",
        "path_parameters": [],
        "query": [],
        "headers": [
          {
            "name": "Content-Type",
            "value": "application/json"
          }
        ],
        "body": {
          "device_keys": {
            "@alice:example.org": []
          }
        },
        "encoded_uri": "/_matrix/client/v3/keys/query"
      },
      "response_cases": [
        "success",
        "error",
        "rate_limited"
      ],
      "oracle_comparison": {
        "mode": "ruma_outgoing_request",
        "coverage": [
          "method",
          "encoded_uri",
          "body"
        ]
      },
      "responses": [
        {
          "kind": "success",
          "status": 200,
          "headers": [
            {
              "name": "Content-Type",
              "value": "application/json"
            }
          ],
          "body": {},
          "parsing": {
            "expectation": "endpoint_success"
          }
        },
        {
          "kind": "error",
          "status": 403,
          "headers": [
            {
              "name": "Content-Type",
              "value": "application/json"
            }
          ],
          "body": {
            "errcode": "M_FORBIDDEN",
            "error": "request rejected"
          },
          "parsing": {
            "expectation": "matrix_error",
            "errcode": "M_FORBIDDEN"
          }
        },
        {
          "kind": "rate_limited",
          "status": 429,
          "headers": [
            {
              "name": "Retry-After",
              "value": "120"
            },
            {
              "name": "Content-Type",
              "value": "application/json"
            }
          ],
          "body": {
            "errcode": "M_LIMIT_EXCEEDED",
            "error": "rate limited",
            "retry_after_ms": 5000
          },
          "parsing": {
            "expectation": "retry_after",
            "retry_source": "retry_after_header_precedes_legacy_body",
            "retry_after_ms": 120000
          }
        }
      ]
    },
    {
      "schema_version": "icwm.g0c.request-vector.v2",
      "vector_id": "8edafff156442cc40ae6de99d19a4f0151a3923ac7ae73fa4584153fdd70f539",
      "operation": "keys_claim",
      "purpose": "keys_claim",
      "request": {
        "method": "POST",
        "path": "/_matrix/client/v3/keys/claim",
        "path_parameters": [],
        "query": [],
        "headers": [
          {
            "name": "Content-Type",
            "value": "application/json"
          }
        ],
        "body": {
          "one_time_keys": {
            "@alice:example.org": {
              "ALICE": "signed_curve25519"
            }
          }
        },
        "encoded_uri": "/_matrix/client/v3/keys/claim"
      },
      "response_cases": [
        "success",
        "error",
        "rate_limited"
      ],
      "oracle_comparison": {
        "mode": "ruma_outgoing_request",
        "coverage": [
          "method",
          "encoded_uri",
          "body"
        ]
      },
      "responses": [
        {
          "kind": "success",
          "status": 200,
          "headers": [
            {
              "name": "Content-Type",
              "value": "application/json"
            }
          ],
          "body": {},
          "parsing": {
            "expectation": "endpoint_success"
          }
        },
        {
          "kind": "error",